[
  {
    "id": "leetcode-643-source",
    "title": "Maximum Average Subarray I",
    "url": "https://leetcode.com/problems/maximum-average-subarray-i/",
    "kind": "problem",
    "status": "verified",
    "checked_on": "2026-09-28",
    "notes": "已核對題號 643、Easy、固定長度 k 與題目網址。"
  },
  {
    "id": "blind-75",
    "title": "Blind 75 作者連結的原始轉載題單",
    "url": "https://leetcode.com/discuss/post/460599/blind-75-leetcode-questions-by-krishnade-9xev/",
    "kind": "collection",
    "status": "verified",
    "checked_on": "2026-09-29",
    "notes": "經作者 https://www.techinterviewhandbook.org/best-practice-questions/ 連至此原始題單，核對本專案的正向歸屬：leetcode-3、76、33、11、141、15、198、200、39；不是 Grind 75 或作者五週精簡題單。"
  },
  {
    "id": "top-interview-150",
    "title": "LeetCode Top Interview 150",
    "url": "https://leetcode.com/studyplan/top-interview-150/",
    "kind": "collection",
    "status": "pending",
    "checked_on": "2026-09-29",
    "notes": "已比對使用者提供的 leetcodetop150.md：149 筆不重複主題號，51 另註或 52，尚非明確完整清單。本庫出現在清單的 13 題（3、209、76、34、33、167、11、141、15、26、198、200、39）名稱與難度一致；此為本機清單比對，非獨立官方歸屬驗證。官方頁仍只取得摘要，保留 pending，不新增 collection_source_ids。詳見 docs/top150-audit.md。"
  },
  {
    "id": "leetcode-3-source",
    "title": "Longest Substring Without Repeating Characters",
    "url": "https://leetcode.com/problems/longest-substring-without-repeating-characters/",
    "kind": "problem",
    "status": "verified",
    "checked_on": "2026-09-29",
    "notes": "已核對官方題目頁的題號、名稱、難度與辨識條件；未聲明題單歸屬。"
  },
  {
    "id": "leetcode-209-source",
    "title": "Minimum Size Subarray Sum",
    "url": "https://leetcode.com/problems/minimum-size-subarray-sum/",
    "kind": "problem",
    "status": "verified",
    "checked_on": "2026-09-29",
    "notes": "已核對官方題目頁的題號、名稱、難度與辨識條件；未聲明題單歸屬。"
  },
  {
    "id": "leetcode-76-source",
    "title": "Minimum Window Substring",
    "url": "https://leetcode.com/problems/minimum-window-substring/",
    "kind": "problem",
    "status": "verified",
    "checked_on": "2026-09-29",
    "notes": "已核對官方題目頁的題號、名稱、難度與辨識條件；未聲明題單歸屬。"
  },
  {
    "id": "leetcode-567-source",
    "title": "Permutation in String",
    "url": "https://leetcode.com/problems/permutation-in-string/",
    "kind": "problem",
    "status": "verified",
    "checked_on": "2026-09-29",
    "notes": "已核對官方題目頁的題號、名稱、難度與辨識條件；未聲明題單歸屬。"
  },
  {
    "id": "leetcode-239-source",
    "title": "Sliding Window Maximum",
    "url": "https://leetcode.com/problems/sliding-window-maximum/",
    "kind": "problem",
    "status": "verified",
    "checked_on": "2026-09-29",
    "notes": "已核對官方題目頁的題號、名稱、難度與辨識條件；未聲明題單歸屬。"
  },
  {
    "id": "leetcode-704-source",
    "title": "Binary Search",
    "url": "https://leetcode.com/problems/binary-search/",
    "kind": "problem",
    "status": "verified",
    "checked_on": "2026-09-29",
    "notes": "已核對官方題目頁的題號、名稱、難度與條件；題單歸屬尚未逐題核對。"
  },
  {
    "id": "leetcode-34-source",
    "title": "Find First and Last Position of Element in Sorted Array",
    "url": "https://leetcode.com/problems/find-first-and-last-position-of-element-in-sorted-array/",
    "kind": "problem",
    "status": "verified",
    "checked_on": "2026-09-29",
    "notes": "已核對官方題目頁的題號、名稱、難度與條件；題單歸屬尚未逐題核對。"
  },
  {
    "id": "leetcode-33-source",
    "title": "Search in Rotated Sorted Array",
    "url": "https://leetcode.com/problems/search-in-rotated-sorted-array/",
    "kind": "problem",
    "status": "verified",
    "checked_on": "2026-09-29",
    "notes": "已核對官方題目頁的題號、名稱、難度與條件；題單歸屬尚未逐題核對。"
  },
  {
    "id": "leetcode-875-source",
    "title": "Koko Eating Bananas",
    "url": "https://leetcode.com/problems/koko-eating-bananas/",
    "kind": "problem",
    "status": "verified",
    "checked_on": "2026-09-29",
    "notes": "已核對官方題目頁的題號、名稱、難度與條件；題單歸屬尚未逐題核對。"
  },
  {
    "id": "leetcode-1011-source",
    "title": "Capacity To Ship Packages Within D Days",
    "url": "https://leetcode.com/problems/capacity-to-ship-packages-within-d-days/",
    "kind": "problem",
    "status": "verified",
    "checked_on": "2026-09-29",
    "notes": "已核對官方題目頁的題號、名稱、難度與條件；題單歸屬尚未逐題核對。"
  },
  {
    "id": "leetcode-167-source",
    "title": "Two Sum II - Input Array Is Sorted",
    "url": "https://leetcode.com/problems/two-sum-ii-input-array-is-sorted/",
    "kind": "problem",
    "status": "verified",
    "checked_on": "2026-09-29",
    "notes": "已核對官方題目頁的題號、名稱、難度與條件；題單歸屬尚未逐題核對。"
  },
  {
    "id": "leetcode-11-source",
    "title": "Container With Most Water",
    "url": "https://leetcode.com/problems/container-with-most-water/",
    "kind": "problem",
    "status": "verified",
    "checked_on": "2026-09-29",
    "notes": "已核對官方題目頁的題號、名稱、難度與條件；題單歸屬尚未逐題核對。"
  },
  {
    "id": "leetcode-141-source",
    "title": "Linked List Cycle",
    "url": "https://leetcode.com/problems/linked-list-cycle/",
    "kind": "problem",
    "status": "verified",
    "checked_on": "2026-09-29",
    "notes": "已核對官方題目頁的題號、名稱、難度與條件；題單歸屬尚未逐題核對。"
  },
  {
    "id": "leetcode-876-source",
    "title": "Middle of the Linked List",
    "url": "https://leetcode.com/problems/middle-of-the-linked-list/",
    "kind": "problem",
    "status": "verified",
    "checked_on": "2026-09-29",
    "notes": "已核對官方題目頁的題號、名稱、難度與條件；題單歸屬尚未逐題核對。"
  },
  {
    "id": "leetcode-15-source",
    "title": "3Sum",
    "url": "https://leetcode.com/problems/3sum/",
    "kind": "problem",
    "status": "verified",
    "checked_on": "2026-09-29",
    "notes": "已核對官方題目頁的題號、名稱、難度與條件；題單歸屬尚未逐題核對。"
  },
  {
    "id": "leetcode-283-source",
    "title": "Move Zeroes",
    "url": "https://leetcode.com/problems/move-zeroes/",
    "kind": "problem",
    "status": "verified",
    "checked_on": "2026-09-29",
    "notes": "已核對官方題目頁的題號、名稱、難度與條件；題單歸屬尚未逐題核對。"
  },
  {
    "id": "leetcode-26-source",
    "title": "Remove Duplicates from Sorted Array",
    "url": "https://leetcode.com/problems/remove-duplicates-from-sorted-array/",
    "kind": "problem",
    "status": "verified",
    "checked_on": "2026-09-29",
    "notes": "已核對官方題目頁的題號、名稱、難度與條件；題單歸屬尚未逐題核對。"
  },
  {
    "id": "leetcode-78-source",
    "title": "Subsets",
    "url": "https://leetcode.com/problems/subsets/",
    "kind": "problem",
    "status": "verified",
    "checked_on": "2026-09-29",
    "notes": "已核對官方題目頁的題號、名稱、難度與條件；題單歸屬尚未逐題核對。"
  },
  {
    "id": "leetcode-198-source",
    "title": "House Robber",
    "url": "https://leetcode.com/problems/house-robber/",
    "kind": "problem",
    "status": "verified",
    "checked_on": "2026-09-29",
    "notes": "已核對官方題目頁的題號、名稱、難度與條件；題單歸屬尚未逐題核對。"
  },
  {
    "id": "leetcode-200-source",
    "title": "Number of Islands",
    "url": "https://leetcode.com/problems/number-of-islands/",
    "kind": "problem",
    "status": "verified",
    "checked_on": "2026-09-29",
    "notes": "已核對官方題目頁的題號、難度與輸入條件。"
  },
  {
    "id": "leetcode-39-source",
    "title": "Combination Sum",
    "url": "https://leetcode.com/problems/combination-sum/",
    "kind": "problem",
    "status": "verified",
    "checked_on": "2026-09-29",
    "notes": "已核對官方題目頁的題號、難度與輸入條件。"
  }
]
